### ISSUE TITLE
gcapeverde is not accessible via other VPN clients

### ISSUE THREAD

**Issue by gawertm** [giantswarm/roadmap#2802]
https://gigantic.slack.com/archives/CLPMFRVU6/p1694431318939049?thread_ts=1694430659.111159&cid=CLPMFRVU6

**Comment by glitchcrab** [comment]
issue only seems to affect linux users with openvpn

**Comment by glitchcrab** [comment]
after a lot of debugging (see ), it seems that the issue only affects the kube-vip IP which is used for the workloads which are behind the ingress controller. The current state of the troubleshooting shows at least the handshake traffic reaching the node which is 'holding' the VIP at the time, and the traffic is returned back to the client (verified by tcpdump):

````
root@gcapeverde-worker-5c97cbc67fx45b9c-v7hpz:~# tcpdump -i any -n host 172.18.0.1 and host 10.10.222.231 and port https
tcpdump: verbose output suppressed, use -v or -vv for full protocol decode
listening on any, link-type LINUX_SLL (Linux cooked v1), capture size 262144 bytes





15:41:41.126911 IP 172.18.0.1.47014 > 10.10.222.231.443: Flags [S], seq 4152219734, win 64308, options [mss 1398,sackOK,TS val 4004924789 ecr 0,nop,wscale 7], length 0
15:41:41.127058 IP 10.10.222.231.443 > 172.18.0.1.47014: Flags [S.], seq 1079751675, ack 4152219735, win 64308, options [mss 1410,sackOK,TS val 1182406822 ecr 4004924789,nop,wscale 7], length 0
15:41:41.154252 IP 172.18.0.1.47014 > 10.10.222.231.443: Flags [.], ack 1, win 503, options [nop,nop,TS val 4004924817 ecr 1182406822], length 0
15:41:41.160505 IP 172.18.0.1.47014 > 10.10.222.231.443: Flags [P.], seq 1:518, ack 1, win 503, options [nop,nop,TS val 4004924823 ecr 1182406822], length 517
15:41:41.160590 IP 10.10.222.231.443 > 172.18.0.1.47014: Flags [.], ack 518, win 501, options [nop,nop,TS val 1182406855 ecr 4004924823], length 0
15:41:41.166131 IP 10.10.222.231.443 > 172.18.0.1.47014: Flags [P.], seq 1:2773, ack 518, win 501, options [nop,nop,TS val 1182406861 ecr 4004924823], length 2772
15:41:41.166158 IP 10.10.222.231.443 > 172.18.0.1.47014: Flags [P.], seq 2773:4097, ack 518, win 501, options [nop,nop,TS val 1182406861 ecr 4004924823], length 1324
15:41:41.167664 IP 10.10.222.231.443 > 172.18.0.1.47014: Flags [P.], seq 4097:4567, ack 518, win 501, options [nop,nop,TS val 1182406862 ecr 4004924823], length 470
15:41:41.192819 IP 172.18.0.1.47014 > 10.10.222.231.443: Flags [.], ack 1, win 503, options [nop,nop,TS val 4004924856 ecr 1182406855,nop,nop,sack 1 {2773:4097}], length 0
15:41:41.195486 IP 172.18.0.1.47014 > 10.10.222.231.443: Flags [.], ack 1, win 503, options [nop,nop,TS val 4004924857 ecr 1182406855,nop,nop,sack 1 {2773:4567}], length 0
15:41:41.213798 IP 10.10.222.231.443 > 172.18.0.1.47014: Flags [P.], seq 1:2773, ack 518, win 501, options [nop,nop,TS val 1182406908 ecr 4004924857], length 2772
15:41:41.445794 IP 10.10.222.231.443 > 172.18.0.1.47014: Flags [.], seq 1:1387, ack 518, win 501, options [nop,nop,TS val 1182407140 ecr 4004924857], length 1386
15:41:41.925762 IP 10.10.222.231.443 > 172.18.0.1.47014: Flags [.], seq 1:1387, ack 518, win 501, options [nop,nop,TS val 1182407620 ecr 4004924857], length 1386
15:41:42.853748 IP 10.10.222.231.443 > 172.18.0.1.47014: Flags [.], seq 1:1387, ack 518, win 501, options [nop,nop,TS val 1182408548 ecr 4004924857], length 1386
15:41:44.709802 IP 10.10.222.231.443 > 172.18.0.1.47014: Flags [.], seq 1:1387, ack 518, win 501, options [nop,nop,TS val 1182410404 ecr 4004924857], length 1386
15:41:48.389808 IP 10.10.222.231.443 > 172.18.0.1.47014: Flags [.], seq 1:1387, ack 518, win 501, options [nop,nop,TS val 1182414084 ecr 4004924857], length 1386
15:41:55.813773 IP 10.10.222.231.443 > 172.18.0.1.47014: Flags [.], seq 1:1387, ack 518, win 501, options [nop,nop,TS val 1182421508 ecr 4004924857], length 1386
```

**Comment by glitchcrab** [comment]
the issue maybe only affects Arch user? https://gigantic.slack.com/archives/CLPMFRVU6/p1695397573738059

**Comment by glitchcrab** [comment]
Troubleshooting ideas for monday: 

- scale nginx to 1 replica
- access host via SSH and tcpdump in nginx netns

**Comment by glitchcrab** [comment]
running nginx in debug mode and attempting to connect to grafana:

```
➜  stern nginx --include 3831
+ nginx-ingress-controller-app-55646c5948-6bs87 › controller
+ nginx-ingress-controller-app-55646c5948-ckjt5 › controller
nginx-ingress-controller-app-55646c5948-6bs87 controller 2023/09/22 17:18:19 [debug] 303#303: *2718 event timer del: 19: 283831037
nginx-ingress-controller-app-55646c5948-ckjt5 controller 2023/09/22 17:16:46 [debug] 301#301: *3831 accept: 10.244.5.149:54504 fd:15
nginx-ingress-controller-app-55646c5948-ckjt5 controller 2023/09/22 17:16:46 [debug] 301#301: *3831 event timer add: 15: 60000:283795187
nginx-ingress-controller-app-55646c5948-ckjt5 controller 2023/09/22 17:16:46 [debug] 301#301: *3831 reusable connection: 1
nginx-ingress-controller-app-55646c5948-ckjt5 controller 2023/09/22 17:16:46 [debug] 301#301: *3831 epoll add event: fd:15 op:1 ev:80002001
nginx-ingress-controller-app-55646c5948-ckjt5 controller 2023/09/22 17:16:46 [debug] 301#301: *3831 http check ssl handshake
nginx-ingress-controller-app-55646c5948-ckjt5 controller 2023/09/22 17:16:46 [debug] 301#301: *3831 http recv(): 1
nginx-ingress-controller-app-55646c5948-ckjt5 controller 2023/09/22 17:16:46 [debug] 301#301: *3831 https ssl handshake: 0x16
nginx-ingress-controller-app-55646c5948-ckjt5 controller 2023/09/22 17:16:46 [debug] 301#301: *3831 tcp_nodelay
nginx-ingress-controller-app-55646c5948-ckjt5 controller 2023/09/22 17:16:46 [debug] 301#301: *3831 reusable connection: 0
nginx-ingress-controller-app-55646c5948-ckjt5 controller 2023/09/22 17:16:46 [debug] 301#301: *3831 SSL server name: "grafana.gcapeverde.test.gigantic.io"
nginx-ingress-controller-app-55646c5948-ckjt5 controller 2023/09/22 17:16:46 [debug] 301#301: *3831 SSL ALPN supported by client: h2
nginx-ingress-controller-app-55646c5948-ckjt5 controller 2023/09/22 17:16:46 [debug] 301#301: *3831 SSL ALPN supported by client: http/1.1
nginx-ingress-controller-app-55646c5948-ckjt5 controller 2023/09/22 17:16:46 [debug] 301#301: *3831 SSL ALPN selected: h2
nginx-ingress-controller-app-55646c5948-ckjt5 controller 2023/09/22 17:16:46 [debug] 301#301: *3831 ssl cert: connection reusable: 0
nginx-ingress-controller-app-55646c5948-ckjt5 controller 2023/09/22 17:16:46 [debug] 301#301: *3831 lua_certificate_by_lua: handler return value: 0, cert cb exit code: 1
nginx-ingress-controller-app-55646c5948-ckjt5 controller 2023/09/22 17:16:46 [debug] 301#301: *3831 SSL_do_handshake: -1
nginx-ingress-controller-app-55646c5948-ckjt5 controller 2023/09/22 17:16:46 [debug] 301#301: *3831 SSL_get_error: 2
nginx-ingress-controller-app-55646c5948-ckjt5 controller 2023/09/22 17:17:46 [debug] 301#301: *3831 event timer del: 15: 283795187
nginx-ingress-controller-app-55646c5948-ckjt5 controller 2023/09/22 17:17:46 [debug] 301#301: *3831 SSL handshake handler: 0
nginx-ingress-controller-app-55646c5948-ckjt5 controller 2023/09/22 17:17:46 [info] 301#301: *3831 client timed out (110: Operation timed out) while SSL handshaking, client: 10.244.5.149, server: 0.0.0.0:443
nginx-ingress-controller-app-55646c5948-ckjt5 controller 2023/09/22 17:17:46 [debug] 301#301: *3831 close http connection: 15
nginx-ingress-controller-app-55646c5948-ckjt5 controller 2023/09/22 17:17:46 [debug] 301#301: *3831 reusable connection: 0
nginx-ingress-controller-app-55646c5948-ckjt5 controller 2023/09/22 17:17:46 [debug] 301#301: *3831 free: 00007FADE6CD0610, unused: 16
```

**Comment by glitchcrab** [comment]
After some experimentation, it seems that the max MTU possible without needing fragmentation is `1410`:

```
shw ~ ☸ gs-leopard:kube-system ✗  ping -s 1410 -M do -c 2 10.10.222.126
PING 10.10.222.126 (10.10.222.126) 1410(1438) bytes of data.
1418 bytes from 10.10.222.126: icmp_seq=1 ttl=62 time=27.9 ms
1418 bytes from 10.10.222.126: icmp_seq=2 ttl=62 time=27.5 ms
```

Setting it higher causes fragmentation to be required:

```
shw ~ ☸ gs-leopard:kube-system ➜  ping -s 1411 -M do -c 2 10.10.222.126
PING 10.10.222.126 (10.10.222.126) 1411(1439) bytes of data.
ping: local error: message too long, mtu=1438
ping: local error: message too long, mtu=1438
```

Also confirmed that the same packet size is required when pinging Leopard's bastion:

```
shw ~ ☸ gs-leopard:kube-system ✗  ping -s 1410 -M do -c 2 172.28.0.190
PING 172.28.0.190 (172.28.0.190) 1410(1438) bytes of data.
1418 bytes from 172.28.0.190: icmp_seq=1 ttl=62 time=30.8 ms
1418 bytes from 172.28.0.190: icmp_seq=2 ttl=62 time=32.6 ms

shw ~ ☸ gs-leopard:kube-system ➜  ping -s 1411 -M do -c 2 172.28.0.190
PING 172.28.0.190 (172.28.0.190) 1411(1439) bytes of data.
ping: local error: message too long, mtu=1438
ping: local error: message too long, mtu=1438
```

However the issue doesn't exist when pinging an IP which lives on the VPN server:

```
shw ~ ☸ gs-leopard:kube-system ➜  ping -s 1472 -M do -c 2 10.0.253.1
PING 10.0.253.1 (10.0.253.1) 1472(1500) bytes of data.
1480 bytes from 10.0.253.1: icmp_seq=1 ttl=64 time=23.2 ms
1480 bytes from 10.0.253.1: icmp_seq=2 ttl=64 time=21.9 ms
```

**Comment by glitchcrab** [comment]
The MTU size will be a combination of the standard ethernet headers and the overhead added by the IPSEC VPN.

Current thinking is that we are only seeing this on gcapeverde and gmc because we talk directly to the nodes - there is no vsphere loadbalancer in front of them. We don't do this anywhere else and so we haven't seen this happen before. Seemingly the path mtu discovery is failing between affected clients and the ingress controller. 

The nodes themselves are fine as they respond to larger packets correctly when fragmentation is allowed:

```
shw ~ ☸ gs-leopard:kube-system ➜  ping -s 1472 -M dont -c 2 10.10.222.126
PING 10.10.222.126 (10.10.222.126) 1472(1500) bytes of data.
1480 bytes from 10.10.222.126: icmp_seq=1 ttl=62 time=30.5 ms
1480 bytes from 10.10.222.126: icmp_seq=2 ttl=62 time=26.9 ms
```

**Comment by glitchcrab** [comment]
tcpdump seems to show that the SSL handshake never completes, although i'm at a loss as to why this only happens for requests being served by nginx. I could spend longer on this, however I feel like it's not time well spent, especially as newer client openvpn configs are already generated with an [even lower mtu](https://github.com/giantswarm/vpn/pull/418). I'll put a post in a news channel and call it a day at that.

**Comment by gawertm** [comment]
hi, yes I agree. but lets have a quick chat in the standup then to check if this can happen in other (customer) installations as well

**Comment by glitchcrab** [comment]
slack announcement posted: https://gigantic.slack.com/archives/C52L7C6SC/p1695748910494979

**Comment by glitchcrab** [comment]
we discussed this in standup and the impact is very minimal.
